{
  "$comment": "Code generated by scripts/generate-meta-schemas.ts; DO NOT EDIT.",
  "$schema": "https://json-schema.org/draft/2020-12/schema",
  "title": "Branding",
  "type": "object",
  "description": "Branding configuration. It has one shape in two places. It is the request\nbody of `POST /branding`, which publishes it as a new immutable revision.\nIt is also a read-only projection on flow responses, which carries the\nproject's latest revision. Locally it is the `.zitadel/branding/` descriptor\nthat `zitadel deploy` publishes.\n\nEvery field is optional. An omitted key uses Zitadel's default, so a\nrevision carrying one color is as valid as one carrying the whole object.\n",
  "additionalProperties": false,
  "properties": {
    "$schema": {
      "type": "string",
      "description": "Editor affordance: path or URL of this file's JSON meta-schema, so an\neditor validates and autocompletes it. The CLI strips it before upload.\nThe platform ignores it.\n"
    },
    "layout": {
      "type": "string",
      "enum": [
        "centered",
        "split"
      ],
      "description": "Layout preset the revision declares, `centered` or `split`. It is\nvalidated on publish and handed to the template as `branding.layout`.\nThe bundled default template does not read it, so changing it alone\nchanges nothing on screen, and it is not an appearance control.\n\nThe designs you can eject (`centered`, `minimal`) ship as templates, and\nboth carry `centered`. `split` appears on revisions published from\nthe earlier split designs. To switch designs, use\n`zitadel branding eject --design <name>` instead of editing this field.\n",
      "default": "centered"
    },
    "liquid_template": {
      "description": "The LiquidJS template for rendering this step. The login component renders\nit into its shadow DOM, with the step's `fields`, `actions` and `gates` as\ncontext.\n",
      "x-local": "file",
      "anyOf": [
        {
          "type": "string",
          "maxLength": 131072
        },
        {
          "$ref": "#/$defs/LocalFileReference"
        }
      ]
    },
    "logo_url": {
      "type": "string",
      "format": "uri",
      "maxLength": 2048,
      "description": "Fallback logo, used only when neither `theme.light.logo_url` nor\n`theme.dark.logo_url` is set. Prefer the per-side logos, because one file\ncannot serve both surfaces.\n",
      "pattern": "^([hH][tT][tT][pP][sS]://(?:\\[[0-9A-Fa-f:.]+\\]|[^/:?#@]+)(?::0*(?:[0-9]|[1-9][0-9]{1,3}|[1-5][0-9]{4}|6[0-4][0-9]{3}|65[0-4][0-9]{2}|655[0-2][0-9]|6553[0-5]))?(?:[/?#]|$)|[hH][tT][tT][pP]://([lL][oO][cC][aA][lL][hH][oO][sS][tT]|127\\.(?:(?:25[0-5]|2[0-4][0-9]|1[0-9]{2}|[1-9]?[0-9])\\.){2}(?:25[0-5]|2[0-4][0-9]|1[0-9]{2}|[1-9]?[0-9])|\\[::1\\])(?::0*(?:[0-9]|[1-9][0-9]{1,3}|[1-5][0-9]{4}|6[0-4][0-9]{3}|65[0-4][0-9]{2}|655[0-2][0-9]|6553[0-5]))?([/?#]|$))"
    },
    "hero_url": {
      "type": "string",
      "format": "uri",
      "maxLength": 2048,
      "description": "Hero image URL, for templates that reference `branding.hero_url`. The\nbundled default template does not use it.\n",
      "pattern": "^([hH][tT][tT][pP][sS]://(?:\\[[0-9A-Fa-f:.]+\\]|[^/:?#@]+)(?::0*(?:[0-9]|[1-9][0-9]{1,3}|[1-5][0-9]{4}|6[0-4][0-9]{3}|65[0-4][0-9]{2}|655[0-2][0-9]|6553[0-5]))?(?:[/?#]|$)|[hH][tT][tT][pP]://([lL][oO][cC][aA][lL][hH][oO][sS][tT]|127\\.(?:(?:25[0-5]|2[0-4][0-9]|1[0-9]{2}|[1-9]?[0-9])\\.){2}(?:25[0-5]|2[0-4][0-9]|1[0-9]{2}|[1-9]?[0-9])|\\[::1\\])(?::0*(?:[0-9]|[1-9][0-9]{1,3}|[1-5][0-9]{4}|6[0-4][0-9]{3}|65[0-4][0-9]{2}|655[0-2][0-9]|6553[0-5]))?([/?#]|$))"
    },
    "theme": {
      "$ref": "#/$defs/BrandingTheme"
    },
    "typography": {
      "$ref": "#/$defs/BrandingTypography"
    },
    "shape": {
      "$ref": "#/$defs/BrandingShape"
    }
  },
  "$defs": {
    "LocalFileReference": {
      "type": "object",
      "additionalProperties": false,
      "required": [
        "$file"
      ],
      "properties": {
        "$file": {
          "type": "string",
          "minLength": 1,
          "description": "Path to the file whose content is this value, relative to the file holding the reference. The CLI inlines it before upload."
        }
      }
    },
    "BrandingTheme": {
      "type": "object",
      "additionalProperties": false,
      "description": "The theme sides this project publishes, and which of them may run.\n\nPublishing one side makes it the only theme that resolves, even under `auto`\nor an operating-system preference for the other. Publishing both lets `auto`\nfollow the operating system, each side using its own logo and palette.\n\nThe element-level `theme` property overrides `mode`. When one side is\npublished it cannot select the other. Publishing neither side leaves\n`mode`, the `theme` property and the operating system to pick one, painted\nwith Zitadel's defaults.\n",
      "properties": {
        "mode": {
          "type": "string",
          "enum": [
            "light",
            "dark",
            "auto"
          ],
          "description": "Which published side may run. `auto` follows the operating system.\n",
          "examples": [
            "auto"
          ]
        },
        "light": {
          "$ref": "#/$defs/BrandingThemeSide"
        },
        "dark": {
          "$ref": "#/$defs/BrandingThemeSide"
        }
      }
    },
    "BrandingThemeSide": {
      "type": "object",
      "additionalProperties": false,
      "description": "One complete theme side. Light and dark are independent: neither inherits\nfrom the other. When a revision publishes one side, the absent side is never\nused, whatever `mode` or the operating system asks for. When it publishes\nneither, either side can resolve and paints Zitadel's defaults.\n",
      "properties": {
        "logo_url": {
          "type": "string",
          "format": "uri",
          "maxLength": 2048,
          "description": "The logo for this theme side. A logo is never recolored, so each side\ncarries its own file. Absent means no logo on this side, unless the\ntop-level `logo_url` is the only one set.\n",
          "pattern": "^([hH][tT][tT][pP][sS]://(?:\\[[0-9A-Fa-f:.]+\\]|[^/:?#@]+)(?::0*(?:[0-9]|[1-9][0-9]{1,3}|[1-5][0-9]{4}|6[0-4][0-9]{3}|65[0-4][0-9]{2}|655[0-2][0-9]|6553[0-5]))?(?:[/?#]|$)|[hH][tT][tT][pP]://([lL][oO][cC][aA][lL][hH][oO][sS][tT]|127\\.(?:(?:25[0-5]|2[0-4][0-9]|1[0-9]{2}|[1-9]?[0-9])\\.){2}(?:25[0-5]|2[0-4][0-9]|1[0-9]{2}|[1-9]?[0-9])|\\[::1\\])(?::0*(?:[0-9]|[1-9][0-9]{1,3}|[1-5][0-9]{4}|6[0-4][0-9]{3}|65[0-4][0-9]{2}|655[0-2][0-9]|6553[0-5]))?([/?#]|$))",
          "examples": [
            "https://cdn.example.com/logo-on-light.svg"
          ]
        },
        "palette": {
          "$ref": "#/$defs/BrandingPalette"
        }
      }
    },
    "BrandingPalette": {
      "type": "object",
      "additionalProperties": false,
      "description": "Semantic colors for one theme side. An omitted key uses Zitadel's default for\nthis side, never the other side's value.\n\nEvery value is a `BrandingColor`, which defines the accepted forms and the\nreason for them. What each key paints is below.\n",
      "properties": {
        "primary": {
          "$ref": "#/$defs/BrandingColor",
          "description": "Brand color. The focus rings are derived from it."
        },
        "on_primary": {
          "$ref": "#/$defs/BrandingColor",
          "description": "Text and icons drawn on `primary`."
        },
        "background": {
          "$ref": "#/$defs/BrandingColor",
          "description": "The surface behind the card."
        },
        "surface": {
          "$ref": "#/$defs/BrandingColor",
          "description": "The card and popover surfaces."
        },
        "muted": {
          "$ref": "#/$defs/BrandingColor",
          "description": "Neutral fills: the secondary button, accents and muted panels."
        },
        "border": {
          "$ref": "#/$defs/BrandingColor",
          "description": "Card and control edges."
        },
        "text": {
          "$ref": "#/$defs/BrandingColor",
          "description": "Body text, and the foreground of every neutral surface. A side that\nsets `muted` without `text` keeps the default label color on it.\n"
        },
        "text_muted": {
          "$ref": "#/$defs/BrandingColor",
          "description": "Secondary text."
        },
        "link": {
          "$ref": "#/$defs/BrandingColor",
          "description": "Link color. Defaults to the surrounding text color, so setting it\ntints exactly the links and nothing else.\n"
        },
        "success": {
          "$ref": "#/$defs/BrandingColor",
          "description": "Valid fields, success alerts and pills."
        },
        "warning": {
          "$ref": "#/$defs/BrandingColor",
          "description": "Warning surfaces. It is stored, but nothing renders it yet."
        },
        "error": {
          "$ref": "#/$defs/BrandingColor",
          "description": "Invalid fields, error alerts and pills."
        }
      }
    },
    "BrandingColor": {
      "type": "string",
      "minLength": 1,
      "maxLength": 128,
      "description": "A color on a theme side: hex (`#4F46E5`), a CSS color name, or a color\nfunction: `rgb()`, `rgba()`, `hsl()`, `hsla()`, `hwb()`, `lab()`, `lch()`,\n`oklab()`, `oklch()`, `color()` or `color-mix()`. `url()` and `var()` are\nrejected. The value is written into a stylesheet, so only forms that resolve\nto a color are stored.\n\nThe pattern fixes the shape: no semicolons, braces, comment markers or\nbackslashes, so a value cannot leave its declaration whatever it spells.\nThe browser decides which names CSS knows. An unrecognized one is stored and\npaints nothing, rather than being refused here.\n",
      "pattern": "^(?:#(?:[0-9a-fA-F]{3,4}|[0-9a-fA-F]{6}|[0-9a-fA-F]{8})|[a-zA-Z]{3,24}|[a-zA-Z][a-zA-Z-]{2,12}\\((?:[0-9a-zA-Z%.,+/# -]|[a-zA-Z][a-zA-Z-]{2,12}\\([0-9a-zA-Z%.,+/# -]*\\))*\\))$",
      "examples": [
        "#4F46E5",
        "#fff",
        "#4F46E5CC",
        "rebeccapurple",
        "currentColor",
        "transparent",
        "rgb(79 70 229)",
        "rgba(79 70 229 / 50%)",
        "oklch(0.7 0.15 250)",
        "color-mix(in oklab, #4F46E5 40%, white)"
      ]
    },
    "BrandingTypography": {
      "type": "object",
      "additionalProperties": false,
      "dependentRequired": {
        "font_url": [
          "font_family"
        ]
      },
      "description": "The typeface the login surface renders in. One face covers both body and\nheadings.\n",
      "properties": {
        "font_family": {
          "type": "string",
          "minLength": 1,
          "maxLength": 256,
          "pattern": "^ *(?:\"[^\"\\\\;{}]*\"|'[^'\\\\;{}]*'|[A-Za-z0-9_-]+(?: [A-Za-z0-9_-]+)*)(?: *, *(?:\"[^\"\\\\;{}]*\"|'[^'\\\\;{}]*'|[A-Za-z0-9_-]+(?: [A-Za-z0-9_-]+)*))* *$",
          "description": "CSS font stack for body and heading text. Include a generic family so\nthe surface still renders when the named face is unavailable.\n\nComma-separated family names, each either an identifier (`Inter`,\n`ui-sans-serif`, `Helvetica Neue`) or a quoted name (`\"APK Futural\"`).\nAnything else is rejected. The stack is written into a stylesheet, so\nonly names are stored, and a quoted name must close the quote it opened.\n",
          "examples": [
            "Inter, ui-sans-serif, sans-serif"
          ]
        },
        "font_url": {
          "type": "string",
          "format": "uri",
          "maxLength": 2048,
          "description": "Stylesheet that loads `font_family`, for example a Google Fonts CSS URL.\nMust be https. Unlike the logo and hero URLs, it does not accept http on\nloopback. Rejected without `font_family`, which would name nothing to paint\nwith.\n\nLoaded only when the login component runs as `variant=\"page\"`, the\nfull-page login. In the default `variant=\"widget\"` it is stored but not\nloaded: the component injects no stylesheet, and the embedding page\nloads the face.\n",
          "pattern": "^[hH][tT][tT][pP][sS]://(?:\\[[0-9A-Fa-f:.]+\\]|[^/:?#@]+)(?::0*(?:[0-9]|[1-9][0-9]{1,3}|[1-5][0-9]{4}|6[0-4][0-9]{3}|65[0-4][0-9]{2}|655[0-2][0-9]|6553[0-5]))?(?:[/?#]|$)",
          "examples": [
            "https://fonts.googleapis.com/css2?family=Inter&display=swap"
          ]
        },
        "scale": {
          "type": "number",
          "minimum": 0.75,
          "maximum": 1.25,
          "description": "Multiplier on the base text sizes, `1` when omitted.",
          "examples": [
            1
          ]
        }
      }
    },
    "BrandingShape": {
      "type": "object",
      "additionalProperties": false,
      "description": "Corner rounding, spacing and logo size. Shared across theme sides.\n",
      "properties": {
        "radius": {
          "description": "Corner rounding for the card, inputs, buttons and alerts: either a\npreset name or an integer number of pixels. One value scales all corner\nsizes in proportion, so the card stays rounder than the controls inside it.\n",
          "oneOf": [
            {
              "$ref": "#/$defs/BrandingRadiusPreset"
            },
            {
              "type": "integer",
              "minimum": 0,
              "maximum": 32
            }
          ],
          "examples": [
            10
          ]
        },
        "density": {
          "type": "string",
          "enum": [
            "compact",
            "regular",
            "comfortable"
          ],
          "description": "Spacing and control height.",
          "examples": [
            "regular"
          ]
        },
        "logo_scale": {
          "type": "number",
          "minimum": 0.5,
          "maximum": 2,
          "description": "Multiplier on the logo's maximum height, `1` when omitted. The image keeps\nits intrinsic aspect ratio inside that cap. No width, height or ratio is stored.\n",
          "examples": [
            1
          ]
        }
      }
    },
    "BrandingRadiusPreset": {
      "type": "string",
      "enum": [
        "none",
        "sm",
        "md",
        "lg",
        "full"
      ],
      "description": "A named corner rounding: `none` (0), `sm` (4), `md` (8), `lg` (12), and\n`full` (pill). Send `full` for a pill rather than a large pixel value.\n",
      "examples": [
        "md"
      ]
    }
  }
}
