{
  "layout": "centered",
  "logo_url": "https://cdn.example.com/logo.svg",
  "theme": {
    "mode": "auto",
    "light": {
      "logo_url": "https://cdn.example.com/logo-on-light.svg",
      "palette": {
        "primary": "#4A90D9",
        "on_primary": "#FFFFFF",
        "background": "#FFFFFF",
        "surface": "#FFFFFF",
        "muted": "#F1F5F9",
        "border": "#E2E8F0",
        "text": "#0F172A",
        "text_muted": "#64748B",
        "link": "#2563EB",
        "success": "#10B981",
        "warning": "#F59E0B",
        "error": "#EF4444"
      }
    },
    "dark": {
      "logo_url": "https://cdn.example.com/logo-on-dark.svg",
      "palette": {
        "primary": "#7C9CFF",
        "on_primary": "#0A0A0A",
        "background": "#0A0A0A",
        "surface": "#111111",
        "muted": "#262626",
        "border": "#262626",
        "text": "#FAFAFA",
        "text_muted": "#A3A3A3",
        "link": "#9DBBFF",
        "success": "#34D399",
        "warning": "#FBBF24",
        "error": "#F87171"
      }
    }
  },
  "typography": {
    "font_family": "Arimo, ui-sans-serif, system-ui, sans-serif",
    "font_url": "https://fonts.googleapis.com/css2?family=Arimo:wght@400;500;700&display=swap",
    "scale": 1.0
  },
  "shape": {
    "radius": "md",
    "density": "regular",
    "logo_scale": 1.0
  }
}
